id,shpcountry,rcvcountry
Barents Sea Shrimp SE Marine biology,Oceanus,Oceanus
Telangana  GmbH & Co. KG,Kondanovia,Oceanus
Costa del Mar Tidepool SE Merchants,Merigrad,Lumakari
-439,NA,Oceanus
-928,NA,Oceanus
Mar de Sirenas Sagl,Mawazam,Oceanus
-5964,NA,Oceanus
Cape Verde Islands  Company,Alverossia,Oceanus
Anthony Limited Liability Company,Mawazam,Oceanus
Olas del Sur Wharf,Islavaria,Oceanus
Tripura  Limited Liability Company Carriers,NA,Oceanus
Stichting S.A. de C.V. and,Arreciviento,Oceanus
-1203,NA,Oceanus
-5813,NA,Oceanus
Sea Striders Ltd. Liability Co &,NA,Oceanus
Lake Malawi  Limited Liability Company,Marebak,Marebak
Turkish Calamari Co Manatee,Marebak,Marebak
Irish Scallop ОАО Investment,NA,Oceanus
The Sea Turtle Plc Express,NA,Oceanus
Mar de Cristalino Manatee NV Express,Oceanus,Oceanus
Wave Watchers SE Express,Mawazam,Oceanus
Yu gou  Ltd. Corporation,Kondanovia,Oceanus
-1021,NA,Oceanus
-557,NA,Oceanus
Playa del Sol A/S,Isliandor,Oceanus
-806,NA,Oceanus
-515,NA,Oceanus
-968,NA,Oceanus
-1094,NA,Oceanus
-289,NA,Oceanus
Coastal Castaway Corp Express,Merigrad,Oceanus
Wave Watchers Seabass SE International,NA,Oceanus
-1193,NA,Oceanus
Indian Ocean Harvesters OJSC Brothers,NA,Oceanus
Kong zhong diao yu  Oyj,Sol y Oceana,Oceanus
-501,NA,Oceanus
-780,NA,Oceanus
Khundu Whale AG Cargo,Oceanus,Oceanus
Blue Horizon Limited Liability Company Freight ,Kondanovia,Oceanus
Kagera River   SE Solutions,Icarnia,Oceanus
-119,NA,Oceanus
-296,NA,Oceanus
-598,NA,Oceanus
Arena del Sol Sagl,Marebak,Oceanus
Belgian Lobster Coral Reef OJSC Transit,Riodelsol,Oceanus
Madhya Pradesh   Roe ОАО & Son's,Oceanus,Oceanus
Neptune's Harvest LC Transport,Riodelsol,Oceanus
Playa del Sol Corporation Freight ,Vesperanda,Oceanus
SeaTrekker Salt spray S.p.A. Freight ,Oceanus,Oceanus
-369,NA,Oceanus
Costa de Coral Kga Delivery,Riodelsol,Oceanus
Portuguese Sea Bass SRL Import,Jiraputra,Oceanus
Costa de la Felicidad BV,Zawalinda,Coralmarica
Nazhivka S.A. de C.V. Overseas,Isliandor,Oceanus
-1155,NA,Oceanus
-3413,NA,Oceanus
Drakensberg  S.A. de C.V. Marine ecology,Coralmarica,Oceanus
Océano del Este SRL,Coralmarica,Coralmarica
Mar de la Costa AS Cargo,Kondanovia,Kondanovia
-9409,NA,Oceanus
French Hake Cargo ship Sagl Services,Marebak,Oceanus
Mar de Cristalino Salt spray,Marebak,Oceanus
Rift Valley fishery Corporation,Nalakond,Oceanus
xiǎo lóng xiā Company,Coralmarica,Oceanus
Diao yu bi sai  Ltd. Liability Co,Coralmarica,Coralmarica
-517,NA,Oceanus
-1823,NA,Oceanus
-323,NA,Oceanus
-7107,NA,Oceanus
Beach Bums Estuary SE Merchants,Valtalmo,Oceanus
Seafarer's Club Pic Transport,Marebak,Kethilim
Haikou GmbH & Co. KG Transport,-22004,Oceanus
-4091,NA,Oceanus
-4012,NA,Oceanus
-9325,NA,Oceanus
-1510,NA,Oceanus
-100,NA,Oceanus
Estrella de Mar Inc,Zimawand,Oceanus
-144,NA,Oceanus
-5840,NA,Oceanus
Caracola del Mar Transit,Coralmarica,Oceanus
Khundu GmbH & Co. KG Solutions,Icarnia,Oceanus
Niger River Delta  Oyster ,Isliandor,Oceanus
Playa del Mar Sagl Marine conservation,Marebak,Oceanus
SE Ltd. Liability Co,Rio Isla,Oceanus
Wave Warriors Ltd. Corporation Express,Coralada,Oceanus
West Bengal  Plc Freight ,NA,Oceanus
-561,NA,Oceanus
Sparrman's bream GmbH Carriers,Coral Solis,Oceanus
Zanzibar Archipelago   S.p.A. Services,Mawazam,Oceanus
Mar de la Luz Plc,Nalakond,Oceanus
Océano Azul Marine ecology,Coralada,Oceanus
Ancla del Mar Kga,Marebak,Oceanus
-3373,NA,Oceanus
bǐ mù yú SE Brothers,Marebak,Oceanus
-967,NA,Oceanus
Blue Horizon S.A. de C.V. Logistics,Oceanus,Oceanus
Estrella del Mar A/S,Zawalinda,Oceanus
SeaSplash Foods Ferry NV Transport,Lumindoria,Oceanus
Estrella del Sol Incorporated Aqua,Merigrad,Oceanus
Saltwater Solitude N.V. International,Polarisdom,Oceanus
-421,NA,Oceanus
-5975,NA,Oceanus
-665,NA,Oceanus
Saltwater Sisters Plc and Son's,NA,Oceanus
French Hake Limited Liability Company Consulting,Oceanus,Oceanus
Ancla Azul S.A. de C.V.,Kondanovia,Oceanus
Balkan Trout Ltd. Liability Co,Rio Isla,Oceanus
Caracola de Coral Shipyard Sp Investment,Coralmarica,Islavaragon
Caspian Sea   OJSC Brothers,Puerto Sol,Oceanus
Dry Creek Company Services,Vesperanda,Maripuerto
Estrella del Mar Ltd. Liability Co,Marebak,Zaloria
Madhya Pradesh  Market Ltd Line,Riodelsol,Oceanus
Makumba Marine life Charter Boat ,Lumindoria,Oceanus
ReefRider Foods LLC Marine ecology,Alverossia,Oceanus
Saharan Oasis  Ges.m.b.H. Transit,Marebak,Orvietonix
Saltwater Solitude Tom yum,Puerto Sol,Zaloria
Yu er he  GmbH,Mango del Oro,Zaloria
Northeast AB Marine ecology,NA,Oceanus
Surf and Sand Oyster  Company Enterprises,Merigrad,Oceanus
Lake Kariba   Ltd Shipping,Mawazam,Oceanus
Costa de Coral Marine,Jiraputra,Oceanus
Tamil Nadu  Market Corp,Utoporiana,Oceanus
Adriatic Mackerel Marine life AG Holdings,NA,Oceanus
OceanGem Limited Liability Company Carriers,Kondanovia,Oceanus
Saltwater Sisters AS Marine life,Coralmarica,Oceanus
Rufiji Delta  Ltd. Liability Co,Isliandor,Oceanus
-1003,NA,Oceanus
FinestSea Limited Liability Company,Coralmarica,Oceanus
-122,NA,Oceanus
Playa del Mar Delivery,Solovarossa,Oceanus
Mar de Plata SRL,Kondanovia,Oceanus
Seaside Summit S.A. de C.V.,Vesperanda,Oceanus
Assam  Market Tilapia Ltd Worldwide,Alverossia,Oceanus
Coral Azul A/S Transport,Coralmarica,Oceanus
S.A. de C.V. Company,Jiraputra,Oceanus
Lake Victoria Nile    A/S,Alverossia,Oceanus
-88,NA,Oceanus
Caracola del Sol S.A. de C.V. Marine ecology,Merigrad,Oceanus
Henties Bay  Sagl Marina,Nalaloria,Oceanus
